{
  "schema_version": "judge_input_schema_v1",
  "record_id": "SAMPLE_OULAD__S-T02__task_aware_data_summarization",
  "evaluation_run_id": "llm_judge_v2_full_208_phase_f5",
  "dataset_id": "SAMPLE_OULAD",
  "task_id": "S-T02",
  "explanation_mode": "task_aware_data_summarization",
  "prompt_version": "judge_prompt_v2_full_208_v1",
  "rubric_version": "judge_rubric_1_to_10_full_208_v1",
  "task_context": {
    "task_name": "Competency gap analysis",
    "scope": "1 student",
    "actionable_question": "Which skill area should I prioritise for improvement?",
    "target_audience": "student",
    "ai_summary_type": "ranking",
    "ai_prompt_hint": "Highlight which competency tags have lowest avg scores. Suggest focus areas.",
    "query_labels": [
      "competency_scores"
    ],
    "explanation_strategy": "distribution"
  },
  "schema_context": {
    "source_tables": [
      "assessment_result",
      "assessment"
    ],
    "key_db_fields": [
      "competency_tag",
      "score_normalized",
      "pass_flag",
      "assessment_type"
    ],
    "output_schema": {
      "required_columns": [
        "competency_tag",
        "avg_score"
      ],
      "optional_columns": [
        "competency_source",
        "assessment_type",
        "pass_rate",
        "assessment_count"
      ]
    },
    "query_labels": [
      "competency_scores"
    ]
  },
  "explanation": {
    "raw_text": "Summary: Your scores show a strong performance overall, with most assessments averaging above 80. However, CMA 8 has the lowest average score, indicating it may be an area to focus on for improvement.\n\nInsights: Lowest Average Score: CMA 8 has the lowest average score of 83, which is significantly lower than the other assessments. This suggests that you may need to dedicate more time to this area to enhance your understanding and performance.\n\nEducational implications: Focusing on CMA 8 could help improve your overall competency and confidence.\n\nRecommendations: high - Review materials and practice problems related to CMA 8. - Improving in this area will likely boost your overall performance and understanding.",
    "structured_payload": {
      "task_id": "S-T02",
      "execution_id": "exec_1781847881158_4c69c270",
      "explanation": {
        "summary": "Your scores show a strong performance overall, with most assessments averaging above 80. However, CMA 8 has the lowest average score, indicating it may be an area to focus on for improvement.",
        "insights": [
          {
            "title": "Lowest Average Score",
            "description": "CMA 8 has the lowest average score of 83, which is significantly lower than the other assessments. This suggests that you may need to dedicate more time to this area to enhance your understanding and performance.",
            "severity": "medium",
            "evidence": [
              {
                "metric": "avg_score",
                "value": 83,
                "comparison": "baseline",
                "delta": null,
                "context": "Lowest score among all assessments"
              }
            ]
          }
        ],
        "educational_implications": [
          "Focusing on CMA 8 could help improve your overall competency and confidence."
        ],
        "recommendations": [
          {
            "priority": "high",
            "action": "Review materials and practice problems related to CMA 8.",
            "rationale": "Improving in this area will likely boost your overall performance and understanding."
          }
        ],
        "warnings": []
      },
      "confidence": {
        "level": "HIGH",
        "reason": "The dataset is complete and provides clear average scores for each competency area.",
        "based_on": [
          "sufficient_data"
        ]
      },
      "explanation_strategy": "distribution",
      "explanation_type": "distribution",
      "ai_summary_method": "task_aware_data_summarization",
      "ai_summary_version": "v1",
      "baseline_available": true,
      "input_summary_type": "full_rows_due_to_small_result",
      "ai_summary_method_warning": null,
      "full_result_row_count": 5,
      "included_row_count": 5,
      "small_result_threshold": 20,
      "small_result_full_rows_applied": true,
      "dataset_row_breakdown": [
        {
          "dataset_name": "competency_scores",
          "row_count": 5,
          "included_row_count": 5
        }
      ],
      "safety_flags": [],
      "degraded": false,
      "meta": {
        "model": "gpt-4o-mini-2024-07-18",
        "latency_ms": 4273,
        "token_usage": {
          "prompt_tokens": 1003,
          "completion_tokens": 297,
          "total_tokens": 1300
        },
        "strategy": "distribution",
        "granularity": "per_assessment",
        "cost_usd": 0.000329
      }
    },
    "generation_metadata": {
      "explanation_artifact_path": "Docs/evaluation_v2/Runs/full_208/phase8_explanations/task_aware_data_summarization/SAMPLE_OULAD/explanation_artifacts/SAMPLE_OULAD__S-T02__task_aware_data_summarization.json",
      "explanation_artifact_sha256": "2d707cbdb96ed7a78d6faaf01cfa423d812cd969364dcf40bc1d0c1fb2188018",
      "ai_service_url": "http://localhost:8000",
      "expected_ai_summary_method": "task_aware_data_summarization",
      "observed_ai_summary_method": "task_aware_data_summarization",
      "degraded": false,
      "model": "gpt-4o-mini-2024-07-18",
      "token_usage": {
        "prompt_tokens": 1003,
        "completion_tokens": 297,
        "total_tokens": 1300
      },
      "latency_ms": 4282,
      "attempts_used": 1
    }
  },
  "evidence_access": {
    "full_result_row_count": 5,
    "full_query_artifacts": [
      {
        "dataset_label": "competency_scores",
        "artifact_path": "Docs/evaluation_v2/Runs/full_208/phase8_evidence_sql/SAMPLE_OULAD/full_query_artifacts/SAMPLE_OULAD__S-T02.json",
        "artifact_sha256": "a1848a3f995f7d5beb2bcfa2fc5eeeb8458cd9832da3ae69a4cc584d044ae3e8",
        "row_count": 5,
        "readable": true
      }
    ],
    "evidence_access_mode": "direct_embedding",
    "small_result_row_threshold": 20,
    "direct_embedding_token_budget": 120000,
    "prompt_embedded_row_count": 5,
    "retrieved_row_count": 0,
    "retrieved_row_count_by_dataset": {},
    "retrieved_row_ranges": [],
    "retrieved_chunk_ids": [],
    "retrieval_log_path": null,
    "retrieval_request_complete": true,
    "retrieval_coverage_status": "not_applicable",
    "full_access_available": true,
    "deterministic_scan_scope": "full_query_artifact_all_rows",
    "deterministic_scan_row_count_by_dataset": {
      "competency_scores": 5
    },
    "full_result_sent_to_llm": true,
    "deterministic_checks": [],
    "checked_claim_types": [],
    "unchecked_claim_types": [
      "semantic_interpretation",
      "causal_framing",
      "actionability_quality"
    ],
    "judge_evidence_citations": []
  },
  "evaluation_requirements": {
    "required_core_outputs": [
      {
        "requirement_id": "S-T02-CORE-01",
        "description": "Identify the competency tags with the lowest average scores."
      }
    ],
    "required_supporting_outputs": [
      {
        "requirement_id": "S-T02-SUPPORT-01",
        "description": "Suggest focus areas grounded in the identified competency gaps."
      }
    ],
    "evaluation_constraints": [],
    "safety_fairness_applicability": "applicable",
    "safety_fairness_note": "Conservative pilot default; human review is required before any not_applicable exception."
  }
}
