{
  "schema_version": "judge_input_schema_v1",
  "record_id": "SAMPLE_OULAD__S-T03__baseline_first_20_rows",
  "evaluation_run_id": "full_208_taskaware_v3_summary",
  "dataset_id": "SAMPLE_OULAD",
  "task_id": "S-T03",
  "explanation_mode": "baseline_first_20_rows",
  "prompt_version": "judge_prompt_v2_pilot_v1",
  "rubric_version": "judge_rubric_1_to_10_pilot_v1",
  "task_context": {
    "task_name": "Peer comparison",
    "scope": "1 student",
    "actionable_question": "Where do I stand compared to my class?",
    "target_audience": "student",
    "ai_summary_type": "multi_metric_comparison",
    "ai_prompt_hint": "Show student's standing (top X%). Explain which metrics are above/below average.",
    "query_labels": [
      "peer_comparison"
    ],
    "explanation_strategy": "comparison"
  },
  "schema_context": {
    "source_tables": [
      "enrollment",
      "assessment_result",
      "assessment",
      "engagement"
    ],
    "key_db_fields": [
      "avg_score [FE cross]",
      "engagement_score [FE cross]",
      "pass_rate [FE cross]",
      "performance_trend [FE cross]"
    ],
    "output_schema": {},
    "query_labels": [
      "peer_comparison"
    ]
  },
  "explanation": {
    "raw_text": "Summary: You are performing exceptionally well compared to your cohort. Your average score, score percentile, and engagement percentile are all significantly higher than the cohort benchmark, indicating strong academic performance and engagement.\n\nInsights: Outstanding Average Score: Your average score of 94.34 is well above the cohort benchmark of 66.68, showcasing your strong academic abilities. | High Score Percentile: With a score percentile of 89.8, you are in the top 10% of your class, while the cohort benchmark is at 50, indicating you are performing significantly better than average. | Strong Engagement: Your engagement percentile of 75 is also above the cohort benchmark of 50, suggesting that you are actively participating and involved in your studies.\n\nEducational implications: Your high performance indicates effective study habits and engagement strategies.\n\nRecommendations: medium - Continue to challenge yourself with advanced materials or projects. - This will help you maintain your high performance and further develop your skills.",
    "structured_payload": {
      "task_id": "S-T03",
      "execution_id": "exec_1781847881232_997b11bc",
      "explanation": {
        "summary": "You are performing exceptionally well compared to your cohort. Your average score, score percentile, and engagement percentile are all significantly higher than the cohort benchmark, indicating strong academic performance and engagement.",
        "insights": [
          {
            "title": "Outstanding Average Score",
            "description": "Your average score of 94.34 is well above the cohort benchmark of 66.68, showcasing your strong academic abilities.",
            "severity": "high",
            "evidence": [
              {
                "metric": "Average score",
                "value": 94.34,
                "comparison": "up_from_previous",
                "delta": 27.66,
                "context": "Compared to cohort benchmark"
              }
            ]
          },
          {
            "title": "High Score Percentile",
            "description": "With a score percentile of 89.8, you are in the top 10% of your class, while the cohort benchmark is at 50, indicating you are performing significantly better than average.",
            "severity": "high",
            "evidence": [
              {
                "metric": "Score percentile",
                "value": 89.8,
                "comparison": "up_from_previous",
                "delta": 39.8,
                "context": "Compared to cohort benchmark"
              }
            ]
          },
          {
            "title": "Strong Engagement",
            "description": "Your engagement percentile of 75 is also above the cohort benchmark of 50, suggesting that you are actively participating and involved in your studies.",
            "severity": "medium",
            "evidence": [
              {
                "metric": "Engagement percentile",
                "value": 75,
                "comparison": "up_from_previous",
                "delta": 25,
                "context": "Compared to cohort benchmark"
              }
            ]
          }
        ],
        "educational_implications": [
          "Your high performance indicates effective study habits and engagement strategies."
        ],
        "recommendations": [
          {
            "priority": "medium",
            "action": "Continue to challenge yourself with advanced materials or projects.",
            "rationale": "This will help you maintain your high performance and further develop your skills."
          }
        ],
        "warnings": []
      },
      "confidence": {
        "level": "HIGH",
        "reason": "Data is clear and shows a strong comparison between your performance and the cohort benchmark.",
        "based_on": [
          "sufficient_data"
        ]
      },
      "explanation_strategy": "comparison",
      "explanation_type": "comparison",
      "ai_summary_method": "baseline_first_20_rows",
      "ai_summary_version": "baseline",
      "baseline_available": true,
      "input_summary_type": "raw_first_20_rows",
      "ai_summary_method_warning": null,
      "full_result_row_count": null,
      "included_row_count": null,
      "small_result_threshold": null,
      "small_result_full_rows_applied": null,
      "dataset_row_breakdown": [],
      "safety_flags": [],
      "degraded": false,
      "meta": {
        "model": "gpt-4o-mini-2024-07-18",
        "latency_ms": 7986,
        "token_usage": {
          "prompt_tokens": 759,
          "completion_tokens": 510,
          "total_tokens": 1269
        },
        "strategy": "comparison",
        "granularity": "semester",
        "cost_usd": 0.00042
      }
    },
    "generation_metadata": {
      "explanation_artifact_path": "Docs/evaluation_v2/Runs/full_208/phase8_explanations/baseline_first_20_rows/SAMPLE_OULAD/explanation_artifacts/SAMPLE_OULAD__S-T03__baseline_first_20_rows.json",
      "explanation_artifact_sha256": "5100a9724ece5c1f15fd23059b2a045a571006877fdaeb50bffa706cb65a9f5c",
      "ai_service_url": "http://localhost:8000",
      "expected_ai_summary_method": "baseline_first_20_rows",
      "observed_ai_summary_method": "baseline_first_20_rows",
      "degraded": false,
      "model": "gpt-4o-mini-2024-07-18",
      "token_usage": {
        "prompt_tokens": 759,
        "completion_tokens": 510,
        "total_tokens": 1269
      },
      "latency_ms": 7988,
      "attempts_used": 1
    }
  },
  "evidence_access": {
    "full_result_row_count": 6,
    "full_query_artifacts": [
      {
        "dataset_label": "peer_comparison",
        "artifact_path": "Docs/evaluation_v2/Runs/full_208/phase8_evidence_sql/SAMPLE_OULAD/full_query_artifacts/SAMPLE_OULAD__S-T03.json",
        "artifact_sha256": "fe610876e89ca66eba912e2edc06e235347cbdec54f8c8c0f344e278d45741b0",
        "row_count": 6,
        "readable": true
      }
    ],
    "evidence_access_mode": "direct_embedding",
    "small_result_row_threshold": 20,
    "direct_embedding_token_budget": 120000,
    "prompt_embedded_row_count": 6,
    "retrieved_row_count": 0,
    "retrieved_row_count_by_dataset": {},
    "retrieved_row_ranges": [],
    "retrieved_chunk_ids": [],
    "retrieval_log_path": null,
    "retrieval_request_complete": true,
    "retrieval_coverage_status": "not_applicable",
    "full_access_available": true,
    "deterministic_scan_scope": "full_query_artifact_all_rows",
    "deterministic_scan_row_count_by_dataset": {
      "peer_comparison": 6
    },
    "full_result_sent_to_llm": true,
    "deterministic_checks": [],
    "checked_claim_types": [],
    "unchecked_claim_types": [
      "semantic_interpretation",
      "causal_framing",
      "actionability_quality"
    ],
    "judge_evidence_citations": []
  },
  "evaluation_requirements": {
    "required_core_outputs": [
      {
        "requirement_id": "S-T03-CORE-01",
        "description": "Show student's standing (top X%)."
      },
      {
        "requirement_id": "S-T03-CORE-02",
        "description": "Explain which metrics are above/below average."
      }
    ],
    "required_supporting_outputs": [],
    "evaluation_constraints": [],
    "safety_fairness_applicability": "applicable",
    "safety_fairness_note": "Conservative pilot default; human review is required before any not_applicable exception."
  }
}
