{
  "schema_version": "judge_input_schema_v1",
  "record_id": "SAMPLE_OULAD__S-T13__baseline_first_20_rows",
  "evaluation_run_id": "llm_judge_v2_full_208_phase_f5",
  "dataset_id": "SAMPLE_OULAD",
  "task_id": "S-T13",
  "explanation_mode": "baseline_first_20_rows",
  "prompt_version": "judge_prompt_v2_full_208_v1",
  "rubric_version": "judge_rubric_1_to_10_full_208_v1",
  "task_context": {
    "task_name": "Action plan generation",
    "scope": "1 student",
    "actionable_question": "What should I do differently starting next week?",
    "target_audience": "student",
    "ai_summary_type": "action_synthesis",
    "ai_prompt_hint": "Synthesise all [FE] risk signals into 3–5 prioritised actions. Reference which FE feature triggered each item.",
    "query_labels": [
      "synthesis_data"
    ],
    "explanation_strategy": "risk"
  },
  "schema_context": {
    "source_tables": [
      "enrollment",
      "student"
    ],
    "key_db_fields": [
      "[AI_SYNTHESIS] avg_score [FE cross]",
      "at_risk_score [FE cross]",
      "engagement_score [FE cross]",
      "absence_rate [FE single]",
      "performance_trend [FE cross]",
      "lifestyle_risk_score [FE single]"
    ],
    "output_schema": {},
    "query_labels": [
      "synthesis_data"
    ]
  },
  "explanation": {
    "raw_text": "Summary: You are currently identified as at high risk due to a combination of low engagement and a declining performance trend. This indicates that while your average score is strong, there are underlying issues that need attention.\n\nInsights: Declining Performance Trend: Your performance trend has decreased, suggesting that your scores may be slipping over time. This is a critical signal to address. | Low Engagement Score: Your engagement score is relatively low, which may affect your learning experience and outcomes. Engaging more actively could help improve your performance.",
    "structured_payload": {
      "task_id": "S-T13",
      "execution_id": "exec_1781847915613_675e4a46",
      "explanation": {
        "summary": "You are currently identified as at high risk due to a combination of low engagement and a declining performance trend. This indicates that while your average score is strong, there are underlying issues that need attention.",
        "insights": [
          {
            "title": "Declining Performance Trend",
            "description": "Your performance trend has decreased, suggesting that your scores may be slipping over time. This is a critical signal to address.",
            "severity": "high",
            "evidence": [
              {
                "metric": "performance_trend",
                "value": -0.7187500000000001,
                "comparison": "down_from_previous",
                "delta": -0.71875,
                "context": "Indicates a significant drop in performance over time."
              }
            ]
          },
          {
            "title": "Low Engagement Score",
            "description": "Your engagement score is relatively low, which may affect your learning experience and outcomes. Engaging more actively could help improve your performance.",
            "severity": "medium",
            "evidence": [
              {
                "metric": "engagement_score",
                "value": 0.20237855036820618,
                "comparison": "baseline",
                "delta": null,
                "context": "A low engagement score can hinder academic success."
              }
            ]
          }
        ],
        "educational_implications": [],
        "recommendations": [],
        "warnings": []
      },
      "confidence": {
        "level": "HIGH",
        "reason": "The data provided is clear and indicates significant risk factors.",
        "based_on": [
          "sufficient_data"
        ]
      },
      "explanation_strategy": "risk",
      "explanation_type": "risk",
      "ai_summary_method": "baseline_first_20_rows",
      "ai_summary_version": "baseline",
      "baseline_available": true,
      "input_summary_type": "raw_first_20_rows",
      "ai_summary_method_warning": null,
      "full_result_row_count": null,
      "included_row_count": null,
      "small_result_threshold": null,
      "small_result_full_rows_applied": null,
      "dataset_row_breakdown": [],
      "safety_flags": [],
      "degraded": false,
      "meta": {
        "model": "gpt-4o-mini-2024-07-18",
        "latency_ms": 7290,
        "token_usage": {
          "prompt_tokens": 658,
          "completion_tokens": 496,
          "total_tokens": 1154
        },
        "strategy": "risk",
        "granularity": "semester",
        "cost_usd": 0.000396
      }
    },
    "generation_metadata": {
      "explanation_artifact_path": "Docs/evaluation_v2/Runs/full_208/phase8_explanations/baseline_first_20_rows/SAMPLE_OULAD/explanation_artifacts/SAMPLE_OULAD__S-T13__baseline_first_20_rows.json",
      "explanation_artifact_sha256": "fe0e59d648f5fd13d0c13b590db052c9bd0204f000c65e2d07e966c7d8fb4f04",
      "ai_service_url": "http://localhost:8000",
      "expected_ai_summary_method": "baseline_first_20_rows",
      "observed_ai_summary_method": "baseline_first_20_rows",
      "degraded": false,
      "model": "gpt-4o-mini-2024-07-18",
      "token_usage": {
        "prompt_tokens": 658,
        "completion_tokens": 496,
        "total_tokens": 1154
      },
      "latency_ms": 7293,
      "attempts_used": 1
    }
  },
  "evidence_access": {
    "full_result_row_count": 1,
    "full_query_artifacts": [
      {
        "dataset_label": "synthesis_data",
        "artifact_path": "Docs/evaluation_v2/Runs/full_208/phase8_evidence_sql/SAMPLE_OULAD/full_query_artifacts/SAMPLE_OULAD__S-T13.json",
        "artifact_sha256": "b1772902aa8b199ec2800c8504de0f6f1c5ba1cdf36dc8e61c650b6c7eb8a145",
        "row_count": 1,
        "readable": true
      }
    ],
    "evidence_access_mode": "direct_embedding",
    "small_result_row_threshold": 20,
    "direct_embedding_token_budget": 120000,
    "prompt_embedded_row_count": 1,
    "retrieved_row_count": 0,
    "retrieved_row_count_by_dataset": {},
    "retrieved_row_ranges": [],
    "retrieved_chunk_ids": [],
    "retrieval_log_path": null,
    "retrieval_request_complete": true,
    "retrieval_coverage_status": "not_applicable",
    "full_access_available": true,
    "deterministic_scan_scope": "full_query_artifact_all_rows",
    "deterministic_scan_row_count_by_dataset": {
      "synthesis_data": 1
    },
    "full_result_sent_to_llm": true,
    "deterministic_checks": [],
    "checked_claim_types": [],
    "unchecked_claim_types": [
      "semantic_interpretation",
      "causal_framing",
      "actionability_quality"
    ],
    "judge_evidence_citations": []
  },
  "evaluation_requirements": {
    "required_core_outputs": [
      {
        "requirement_id": "S-T13-CORE-01",
        "description": "Synthesise all [FE] risk signals into 3–5 prioritised actions."
      },
      {
        "requirement_id": "S-T13-CORE-02",
        "description": "Reference which FE feature triggered each item."
      }
    ],
    "required_supporting_outputs": [],
    "evaluation_constraints": [
      {
        "constraint_id": "S-T13-CONSTRAINT-01",
        "description": "Do not include actions that reference signals not present in returned data."
      },
      {
        "constraint_id": "S-T13-CONSTRAINT-02",
        "description": "Do not invent risk context, urgency, or priority unsupported by returned feature-engineered signals."
      }
    ],
    "safety_fairness_applicability": "applicable",
    "safety_fairness_note": "Conservative pilot default; human review is required before any not_applicable exception."
  }
}
