{
  "schema_version": "judge_input_schema_v1",
  "record_id": "SAMPLE_OULAD__S-B02__baseline_first_20_rows",
  "evaluation_run_id": "full_208_taskaware_v3_summary",
  "dataset_id": "SAMPLE_OULAD",
  "task_id": "S-B02",
  "explanation_mode": "baseline_first_20_rows",
  "prompt_version": "judge_prompt_v2_pilot_v1",
  "rubric_version": "judge_rubric_1_to_10_pilot_v1",
  "task_context": {
    "task_name": "Risk status card",
    "scope": "1 student",
    "actionable_question": "Am I at risk of failing?",
    "target_audience": "student",
    "ai_summary_type": "metric_snapshot",
    "ai_prompt_hint": "State the risk badge (low/medium/high) and at_risk_score out of 5. Use avg_score, pass_threshold, engagement_score, and punctuality_rate when available. If risk is high, name the top 2 likely triggered factors from returned metrics only.",
    "query_labels": [
      "risk_summary"
    ],
    "explanation_strategy": "risk"
  },
  "schema_context": {
    "source_tables": [
      "enrollment",
      "assessment_result",
      "assessment",
      "engagement"
    ],
    "key_db_fields": [
      "at_risk_score [FE]",
      "at_risk_label [FE]; punctuality_rate [FE cross] (OULAD: submission_day/due_day; UCI: 1−absences_rate)"
    ],
    "output_schema": {
      "required_columns": [
        "avg_score",
        "at_risk_score",
        "at_risk_label"
      ],
      "optional_columns": [
        "engagement_score",
        "engagement_score_available",
        "punctuality_rate",
        "previous_attempt_count",
        "score_strategy",
        "score_scale",
        "pass_threshold",
        "target_threshold"
      ]
    },
    "query_labels": [
      "risk_summary"
    ]
  },
  "explanation": {
    "raw_text": "Summary: You are currently identified as being at high risk of failing, with an at-risk score of 3 out of 5. This is primarily due to your low engagement score and punctuality rate.\n\nInsights: Low Engagement Score: Your engagement score is quite low, indicating that you may not be participating fully in your learning activities. | Punctuality Rate: Your punctuality rate is at 0, which means you may be missing classes or deadlines, further impacting your learning.\n\nEducational implications: Improving engagement and attendance can significantly enhance your learning outcomes.\n\nRecommendations: high - Increase participation in class activities and discussions. - Engaging more with the material can help improve your understanding and scores. | high - Establish a routine to ensure timely attendance and submission of assignments. - Being punctual can help you stay on track and reduce the risk of falling behind.",
    "structured_payload": {
      "task_id": "S-B02",
      "execution_id": "exec_1781847857491_7eb409b0",
      "explanation": {
        "summary": "You are currently identified as being at high risk of failing, with an at-risk score of 3 out of 5. This is primarily due to your low engagement score and punctuality rate.",
        "insights": [
          {
            "title": "Low Engagement Score",
            "description": "Your engagement score is quite low, indicating that you may not be participating fully in your learning activities.",
            "severity": "high",
            "evidence": [
              {
                "metric": "engagement_score",
                "value": 0.20237855036820618,
                "comparison": "down_from_previous",
                "delta": null,
                "context": "This score suggests limited interaction with course materials."
              }
            ]
          },
          {
            "title": "Punctuality Rate",
            "description": "Your punctuality rate is at 0, which means you may be missing classes or deadlines, further impacting your learning.",
            "severity": "high",
            "evidence": [
              {
                "metric": "punctuality_rate",
                "value": 0,
                "comparison": "baseline",
                "delta": null,
                "context": "Missing classes can lead to gaps in understanding and performance."
              }
            ]
          }
        ],
        "educational_implications": [
          "Improving engagement and attendance can significantly enhance your learning outcomes."
        ],
        "recommendations": [
          {
            "priority": "high",
            "action": "Increase participation in class activities and discussions.",
            "rationale": "Engaging more with the material can help improve your understanding and scores."
          },
          {
            "priority": "high",
            "action": "Establish a routine to ensure timely attendance and submission of assignments.",
            "rationale": "Being punctual can help you stay on track and reduce the risk of falling behind."
          }
        ],
        "warnings": []
      },
      "confidence": {
        "level": "HIGH",
        "reason": "The data provided is clear and indicates significant risk factors.",
        "based_on": [
          "sufficient_data"
        ]
      },
      "explanation_strategy": "risk",
      "explanation_type": "risk",
      "ai_summary_method": "baseline_first_20_rows",
      "ai_summary_version": "baseline",
      "baseline_available": true,
      "input_summary_type": "raw_first_20_rows",
      "ai_summary_method_warning": null,
      "full_result_row_count": null,
      "included_row_count": null,
      "small_result_threshold": null,
      "small_result_full_rows_applied": null,
      "dataset_row_breakdown": [],
      "safety_flags": [],
      "degraded": false,
      "meta": {
        "model": "gpt-4o-mini-2024-07-18",
        "latency_ms": 6739,
        "token_usage": {
          "prompt_tokens": 672,
          "completion_tokens": 440,
          "total_tokens": 1112
        },
        "strategy": "risk",
        "granularity": "semester",
        "cost_usd": 0.000365
      }
    },
    "generation_metadata": {
      "explanation_artifact_path": "Docs/evaluation_v2/Runs/full_208/phase8_explanations/baseline_first_20_rows/SAMPLE_OULAD/explanation_artifacts/SAMPLE_OULAD__S-B02__baseline_first_20_rows.json",
      "explanation_artifact_sha256": "a9a06690bfd56c3ffdde927a0d517d5d119011debd219fb877eeb3ffccfa31aa",
      "ai_service_url": "http://localhost:8000",
      "expected_ai_summary_method": "baseline_first_20_rows",
      "observed_ai_summary_method": "baseline_first_20_rows",
      "degraded": false,
      "model": "gpt-4o-mini-2024-07-18",
      "token_usage": {
        "prompt_tokens": 672,
        "completion_tokens": 440,
        "total_tokens": 1112
      },
      "latency_ms": 6741,
      "attempts_used": 1
    }
  },
  "evidence_access": {
    "full_result_row_count": 1,
    "full_query_artifacts": [
      {
        "dataset_label": "risk_summary",
        "artifact_path": "Docs/evaluation_v2/Runs/full_208/phase8_evidence_sql/SAMPLE_OULAD/full_query_artifacts/SAMPLE_OULAD__S-B02.json",
        "artifact_sha256": "c23bd0d1b26a55e95142a9decd7fe4d429263519bdb5fb7ff689e284a0912f4f",
        "row_count": 1,
        "readable": true
      }
    ],
    "evidence_access_mode": "direct_embedding",
    "small_result_row_threshold": 20,
    "direct_embedding_token_budget": 120000,
    "prompt_embedded_row_count": 1,
    "retrieved_row_count": 0,
    "retrieved_row_count_by_dataset": {},
    "retrieved_row_ranges": [],
    "retrieved_chunk_ids": [],
    "retrieval_log_path": null,
    "retrieval_request_complete": true,
    "retrieval_coverage_status": "not_applicable",
    "full_access_available": true,
    "deterministic_scan_scope": "full_query_artifact_all_rows",
    "deterministic_scan_row_count_by_dataset": {
      "risk_summary": 1
    },
    "full_result_sent_to_llm": true,
    "deterministic_checks": [],
    "checked_claim_types": [],
    "unchecked_claim_types": [
      "semantic_interpretation",
      "causal_framing",
      "actionability_quality"
    ],
    "judge_evidence_citations": []
  },
  "evaluation_requirements": {
    "required_core_outputs": [
      {
        "requirement_id": "S-B02-CORE-01",
        "description": "State the risk badge (low/medium/high) and at_risk_score out of 5."
      }
    ],
    "required_supporting_outputs": [
      {
        "requirement_id": "S-B02-SUPPORT-01",
        "description": "Use avg_score, pass_threshold, engagement_score, and punctuality_rate when available."
      },
      {
        "requirement_id": "S-B02-SUPPORT-02",
        "description": "If risk is high, name the top 2 likely triggered factors from returned metrics only."
      }
    ],
    "evaluation_constraints": [],
    "safety_fairness_applicability": "applicable",
    "safety_fairness_note": "Conservative pilot default; human review is required before any not_applicable exception."
  }
}
